{
  "$schema": "http://json-schema.org/draft-07/schema#",
  "$id": "http://virtualwear.simulation/schemas/user_preference.schema.json",
  "title": "User Preference Schema",
  "description": "Production-ready JSON schema validating user fashion preferences, physical attributes, budget tiers, interaction history, and optional personalization metrics for Virtual Wear Simulation.",
  "type": "object",
  "required": [
    "userId",
    "name",
    "gender",
    "ageGroup",
    "preferredCategories",
    "preferredColors",
    "preferredStyles",
    "preferredFit",
    "preferredBrands",
    "preferredMaterials",
    "preferredOccasions",
    "preferredSeasons",
    "budgetRange",
    "budgetTier",
    "favoriteSizes",
    "height",
    "weight",
    "bodyType",
    "wishlist",
    "purchaseHistory",
    "recommendationHistory",
    "createdAt",
    "updatedAt"
  ],
  "additionalProperties": false,
  "properties": {
    "userId": {
      "type": "string",
      "minLength": 1,
      "pattern": "^USR\\d{3}$",
      "description": "Unique user identifier code (e.g. USR001, USR012)"
    },
    "name": {
      "type": "string",
      "minLength": 1,
      "description": "Full name of the user"
    },
    "gender": {
      "type": "string",
      "enum": ["men", "women", "unisex"],
      "description": "Gender demographic classification"
    },
    "ageGroup": {
      "type": "string",
      "enum": ["teen", "adult", "senior"],
      "description": "Age group classification"
    },
    "preferredCategories": {
      "type": "array",
      "minItems": 1,
      "uniqueItems": true,
      "items": {
        "type": "string",
        "enum": [
          "tshirt",
          "shirt",
          "jeans",
          "jacket",
          "hoodie",
          "dress",
          "kurta",
          "pants"
        ]
      },
      "description": "Array of preferred clothing categories"
    },
    "preferredColors": {
      "type": "array",
      "minItems": 1,
      "uniqueItems": true,
      "items": {
        "type": "string",
        "minLength": 1
      },
      "description": "List of preferred apparel colors"
    },
    "preferredStyles": {
      "type": "array",
      "minItems": 1,
      "uniqueItems": true,
      "items": {
        "type": "string",
        "enum": ["casual", "formal", "streetwear", "ethnic", "sports"]
      },
      "description": "List of preferred fashion genres"
    },
    "preferredFit": {
      "type": "string",
      "enum": ["slim", "regular", "relaxed", "oversized"],
      "description": "Preferred garment fit classification"
    },
    "preferredBrands": {
      "type": "array",
      "minItems": 1,
      "uniqueItems": true,
      "items": {
        "type": "string",
        "minLength": 1
      },
      "description": "List of preferred clothing brand names"
    },
    "preferredMaterials": {
      "type": "array",
      "minItems": 1,
      "uniqueItems": true,
      "items": {
        "type": "string",
        "minLength": 1
      },
      "description": "List of preferred fabric materials"
    },
    "preferredOccasions": {
      "type": "array",
      "minItems": 1,
      "uniqueItems": true,
      "items": {
        "type": "string",
        "minLength": 1
      },
      "description": "List of preferred wearing occasions"
    },
    "preferredSeasons": {
      "type": "array",
      "minItems": 1,
      "uniqueItems": true,
      "items": {
        "type": "string",
        "enum": ["summer", "winter", "monsoon", "all-season"]
      },
      "description": "List of preferred clothing seasons"
    },
    "budgetRange": {
      "type": "object",
      "required": ["min", "max"],
      "additionalProperties": false,
      "properties": {
        "min": {
          "type": "number",
          "minimum": 0,
          "description": "Minimum budget amount in local currency"
        },
        "max": {
          "type": "number",
          "minimum": 0,
          "description": "Maximum budget amount in local currency"
        }
      },
      "description": "Min and max price boundaries"
    },
    "budgetTier": {
      "type": "string",
      "enum": ["low", "medium", "premium"],
      "description": "Budget category tier"
    },
    "favoriteSizes": {
      "type": "array",
      "minItems": 1,
      "uniqueItems": true,
      "items": {
        "type": "string",
        "minLength": 1
      },
      "description": "Array of user's standard sizes"
    },
    "height": {
      "type": "number",
      "exclusiveMinimum": 0,
      "description": "User height in cm"
    },
    "weight": {
      "type": "number",
      "exclusiveMinimum": 0,
      "description": "User weight in kg"
    },
    "bodyType": {
      "type": "string",
      "enum": ["slim", "athletic", "regular", "curvy", "plus-size"],
      "description": "User body build type"
    },
    "wishlist": {
      "type": "array",
      "uniqueItems": true,
      "items": {
        "type": "string",
        "pattern": "^[A-Z]{2,4}\\d{3}$"
      },
      "description": "Array of saved product IDs in wishlist"
    },
    "purchaseHistory": {
      "type": "array",
      "uniqueItems": true,
      "items": {
        "type": "string",
        "pattern": "^[A-Z]{2,4}\\d{3}$"
      },
      "description": "Array of previously purchased product IDs"
    },
    "recommendationHistory": {
      "type": "array",
      "uniqueItems": true,
      "items": {
        "type": "string",
        "pattern": "^[A-Z]{2,4}\\d{3}$"
      },
      "description": "History of recommended product IDs"
    },
    "location": {
      "type": "object",
      "required": ["country", "state", "city"],
      "additionalProperties": false,
      "properties": {
        "country": { "type": "string", "minLength": 1 },
        "state": { "type": "string", "minLength": 1 },
        "city": { "type": "string", "minLength": 1 }
      },
      "description": "Optional geographic location of the user"
    },
    "climate": {
      "type": "string",
      "enum": ["tropical", "temperate", "cold", "desert", "coastal"],
      "description": "Optional local climate zone classification"
    },
    "favoriteColorsFrequency": {
      "type": "object",
      "additionalProperties": {
        "type": "integer",
        "minimum": 0
      },
      "description": "Optional color preference frequency counts"
    },
    "interactionMetrics": {
      "type": "object",
      "required": ["productsViewed", "productsLiked", "productsPurchased"],
      "additionalProperties": false,
      "properties": {
        "productsViewed": { "type": "integer", "minimum": 0 },
        "productsLiked": { "type": "integer", "minimum": 0 },
        "productsPurchased": { "type": "integer", "minimum": 0 }
      },
      "description": "Optional catalog interaction engagement counters"
    },
    "lastPreferenceUpdate": {
      "type": "string",
      "pattern": "^\\d{4}-\\d{2}-\\d{2}T\\d{2}:\\d{2}:\\d{2}",
      "description": "Optional ISO 8601 timestamp for last preference update"
    },
    "createdAt": {
      "type": "string",
      "pattern": "^\\d{4}-\\d{2}-\\d{2}T\\d{2}:\\d{2}:\\d{2}",
      "description": "ISO 8601 creation timestamp"
    },
    "updatedAt": {
      "type": "string",
      "pattern": "^\\d{4}-\\d{2}-\\d{2}T\\d{2}:\\d{2}:\\d{2}",
      "description": "ISO 8601 last update timestamp"
    }
  }
}
